{
  "schema_version": "1.0.0",
  "assessment_id": "golden-type2-ai-ethics",
  "overview": {
    "grade": "고2/3",
    "duration_minutes": 45,
    "lesson_mode": "synthesis-writing",
    "materials": ["학생용 문제지", "A/B 정보 조직자", "패러프레이징 점검표"],
    "objectives": [
      "학생은 A와 B의 핵심 문제와 영향을 각각 요약한다.",
      "학생은 두 정보를 연결하고 복사 없이 한 문단으로 쓴다."
    ]
  },
  "standards": [
    {
      "code": "10공영1-01-04",
      "statement_ko": "말이나 글에 나타난 일이나 사건의 논리적 관계를 파악한다.",
      "performance_verb": "파악한다",
      "lesson_evidence": "학생은 A의 편향과 B의 개인정보 문제의 원인 및 영향을 표에 기록한다.",
      "condition_ids": ["C2"]
    },
    {
      "code": "10공영1-02-05",
      "statement_ko": "듣거나 읽은 내용을 요약하여 말하거나 기술한다.",
      "performance_verb": "요약한다",
      "lesson_evidence": "학생은 A와 B의 핵심을 공통 해결책과 함께 한 문단으로 통합한다.",
      "condition_ids": ["C1", "C3"]
    }
  ],
  "passage_analysis": {
    "flow": ["A는 알고리즘 편향의 위험을 제시한다.", "B는 개인정보 통제 상실과 해결책을 제시한다."],
    "key_vocabulary": ["bias", "privacy", "regulation", "guideline"],
    "target_grammar": ["which/that 관계대명사", "원인-결과 연결어"],
    "background_knowledge": ["데이터 기반 판단과 개인정보 보호의 관계를 간단히 설명한다."]
  },
  "sequence": [
    {
      "phase": "mapping",
      "minutes": 15,
      "teacher_actions": ["A/B 조직자의 문제-영향-해결책 칸을 안내한다."],
      "student_actions": ["각 지문에서 핵심 정보를 찾아 표에 적는다."],
      "questions": ["A와 B의 문제는 어떤 영향을 만드는가?"],
      "expected_responses": ["편향은 부당한 대우를, 개인정보 수집은 통제 상실을 만들 수 있다."],
      "checks_for_understanding": ["두 행에 문제와 영향이 모두 있는지 확인한다."]
    },
    {
      "phase": "paraphrase",
      "minutes": 15,
      "teacher_actions": ["핵심어를 유지하되 문장 구조를 바꾸는 예를 보여 준다."],
      "student_actions": ["지문 문장을 의미가 유지되도록 다시 쓴다."],
      "questions": ["어떤 단어와 구조를 바꾸면 복사를 피할 수 있는가?"],
      "expected_responses": ["동의어와 다른 주어 또는 연결 구조를 사용할 수 있다."],
      "checks_for_understanding": ["연속으로 겹치는 단어가 없는지 표본을 확인한다."]
    },
    {
      "phase": "synthesis",
      "minutes": 15,
      "teacher_actions": ["두 문제와 공통 해결책을 한 문단으로 조직하게 한다."],
      "student_actions": ["A/B 핵심과 해결책을 연결해 작성하고 자기점검한다."],
      "questions": ["마지막 문장은 두 문제에 어떤 공통 대응을 제안하는가?"],
      "expected_responses": ["규제와 윤리 지침으로 사람을 보호해야 한다."],
      "checks_for_understanding": ["C1~C3 체크 표시와 해결책 포함 여부를 확인한다."]
    }
  ],
  "differentiation": {
    "support": {"sentence_frames": ["A raises ___, while B shows ___."], "word_bank": ["bias", "privacy", "protect"], "hints": ["A와 B에서 문제를 하나씩 먼저 찾는다."]},
    "core": {"organizer": ["A 문제-영향", "B 문제-영향", "공통 해결책"], "prompts": ["두 문제의 공통 위험을 연결한다."]},
    "extension": {"prompts": ["규제와 윤리 지침의 역할을 구분한다."], "challenge_criteria": ["문장 구조를 바꾸면서 의미를 보존한다."]}
  },
  "misconceptions": [
    {"pattern": "A의 정보만 쓰고 B를 빠뜨린다.", "diagnostic_question": "A/B 조직자의 두 행이 모두 답안에 나타나는가?", "teacher_response": "누락된 행을 한 문장으로 먼저 말하게 한다.", "mini_lesson": "문단을 A 문제-B 문제-공통 해결책의 세 역할로 나눈다."}
  ],
  "answer_planning": {
    "condition_to_sentence_map": ["C1: 첫 문장과 둘째 문장에 A/B 핵심을 요약한다.", "C2: 문제와 영향을 원인-결과로 연결한다.", "C3: 마지막 문장에 공통 해결책을 쓰고 패러프레이징을 확인한다."],
    "self_checklist": ["A 포함", "B 포함", "해결책", "연속 복사 없음"]
  },
  "scoring_anchors": [
    {"score": 8, "answer_id": "strong", "rationale_ko": "A/B 핵심과 해결책을 정확하고 자연스럽게 통합한다."},
    {"score": 6, "text": "두 문제는 있으나 한 영향 설명이 약하다.", "rationale_ko": "통합은 되었지만 근거가 약한 경계 사례다."},
    {"score": 4, "text": "A와 해결책만 제시한다.", "rationale_ko": "한 지문 정보가 누락되었다."},
    {"score": 2, "text": "관련 어휘만 나열한다.", "rationale_ko": "논리적 문단이 형성되지 않았다."}
  ],
  "formative_assessment": {
    "mid_lesson_check": "A/B 조직자의 문제와 영향 칸을 확인한다.",
    "peer_checklist": ["A와 B가 모두 있는가?", "영향이 설명되는가?", "지문을 그대로 복사하지 않았는가?"],
    "exit_ticket": "두 문제를 해결하는 공통 원리를 한 문장으로 쓴다.",
    "follow_up": "누락된 지문을 한 문장으로 요약한 뒤 기존 문단에 연결한다."
  }
}
