{
  "schema_version": "1.0.0",
  "assessment_id": "golden-type1-snow-white",
  "overview": {
    "grade": "중1",
    "duration_minutes": 45,
    "lesson_mode": "evidence-writing",
    "materials": ["학생용 문제지", "근거 표시표", "문장 연결어 카드"],
    "objectives": [
      "학생은 지문에서 인물의 행동 근거를 두 가지 찾는다.",
      "학생은 행동과 이유를 한 문단으로 연결해 쓴다."
    ]
  },
  "standards": [
    {
      "code": "9영03-06",
      "statement_ko": "일상생활이나 친숙한 일반적 주제의 글을 읽고 필자의 의도나 목적을 추론한다.",
      "performance_verb": "추론한다",
      "lesson_evidence": "학생은 여왕의 질문과 거울의 응답에서 인물의 의도를 근거와 함께 추론한다.",
      "condition_ids": ["C2"]
    },
    {
      "code": "9영04-01",
      "statement_ko": "일상생활에 관한 주변의 대상이나 상황을 묘사하는 문장을 쓴다.",
      "performance_verb": "쓴다",
      "lesson_evidence": "학생은 인물의 행동과 이유를 연결한 짧은 영어 문단을 쓴다.",
      "condition_ids": ["C1", "C3"]
    }
  ],
  "passage_analysis": {
    "flow": ["여왕은 거울에게 아름다움을 묻는다.", "Snow White가 더 아름다워지자 갈등의 원인이 생긴다."],
    "key_vocabulary": ["queen", "mirror", "beautiful", "answer"],
    "target_grammar": ["because 이유절", "and 연결"],
    "background_knowledge": ["인물의 행동을 말과 사건의 근거로 설명한다."]
  },
  "sequence": [
    {
      "phase": "opening",
      "minutes": 10,
      "teacher_actions": ["거울의 응답이 인물에게 어떤 영향을 주는지 질문한다."],
      "student_actions": ["자신의 예측을 한 문장으로 말한다."],
      "questions": ["여왕은 왜 매일 거울에게 묻는가?"],
      "expected_responses": ["자신이 가장 아름답다는 말을 듣고 싶어서다."],
      "checks_for_understanding": ["예측에 행동과 이유가 함께 있는지 확인한다."]
    },
    {
      "phase": "evidence-reading",
      "minutes": 20,
      "teacher_actions": ["인물의 말과 사건을 근거 표시표에 나누어 적게 한다."],
      "student_actions": ["여왕의 질문과 거울의 응답을 찾아 표시한다."],
      "questions": ["Snow White가 더 아름답다는 응답 뒤에 무엇이 달라지는가?"],
      "expected_responses": ["여왕의 기분과 Snow White와의 관계가 달라질 수 있다."],
      "checks_for_understanding": ["학생이 답변에 지문 근거를 표시했는지 확인한다."]
    },
    {
      "phase": "writing-closing",
      "minutes": 15,
      "teacher_actions": ["행동-이유-근거 순서로 문단을 점검하게 한다."],
      "student_actions": ["조건에 맞는 한 문단을 쓰고 자기점검한다."],
      "questions": ["이유를 because 절로 연결했는가?"],
      "expected_responses": ["행동과 이유를 because로 연결했다."],
      "checks_for_understanding": ["학생의 문단에서 조건별 표시를 확인한다."]
    }
  ],
  "differentiation": {
    "support": {"sentence_frames": ["The queen asks because ___."], "word_bank": ["mirror", "answer", "want"], "hints": ["말과 행동을 먼저 찾는다."]},
    "core": {"organizer": ["행동 -> 근거 -> 이유"], "prompts": ["두 근거를 한 문단에 연결한다."]},
    "extension": {"prompts": ["거울의 역할이 갈등에 미친 영향을 설명한다."], "challenge_criteria": ["근거와 해석을 구분한다."]}
  },
  "misconceptions": [
    {"pattern": "인물의 마음을 근거 없이 단정한다.", "diagnostic_question": "그 생각을 뒷받침하는 말이나 사건은 무엇인가?", "teacher_response": "근거 문장에 밑줄을 긋게 한다.", "mini_lesson": "근거 뒤에 because로 이유를 연결한다."}
  ],
  "answer_planning": {
    "condition_to_sentence_map": ["C1: 첫 문장에서 인물의 행동을 쓴다.", "C2: 둘째 문장에서 지문 근거와 이유를 연결한다.", "C3: 마지막에 because를 사용해 설명을 완성한다."],
    "self_checklist": ["행동", "근거", "이유", "because"]
  },
  "scoring_anchors": [
    {"score": 8, "answer_id": "strong", "rationale_ko": "행동·근거·이유를 모두 정확하고 자연스럽게 연결한다."},
    {"score": 6, "text": "행동과 이유는 있으나 근거가 약하다.", "rationale_ko": "핵심은 있으나 근거 설명이 부족한 경계 사례다."},
    {"score": 4, "text": "행동만 설명하고 이유가 없다.", "rationale_ko": "내용 일부만 충족한다."},
    {"score": 2, "text": "지문과 관련된 단어를 나열한다.", "rationale_ko": "문단과 설명이 형성되지 않았다."}
  ],
  "formative_assessment": {
    "mid_lesson_check": "근거 표시표의 말과 사건 칸을 확인한다.",
    "peer_checklist": ["행동이 있는가?", "근거가 있는가?", "이유가 연결되는가?"],
    "exit_ticket": "인물의 행동과 이유를 한 문장으로 다시 쓴다.",
    "follow_up": "근거가 없는 문장에 지문 표현을 하나 추가해 다시 쓴다."
  }
}
